省,村名,站点,编号,签约时间,开业时间,银行,卡数,存款数,卡均
河北省,石家庄市辛集市田家庄乡试炮营村,辛集市田家庄乡试炮营村,13010068,2014/5/17 8:51,,中国银行,374,5889430,15747.13904
河北省,石家庄市晋州市小樵镇小樵村,晋州市小樵镇小樵村,13010069,2014/5/17 9:00,2014/5/27 0:00,中国银行,175,764578.6,4369.020571
河北省,石家庄市无极县七汲镇西汉村,无极县七汲镇西汉村助农点,13010071,2014/5/17 9:19,,中国银行,197,481509.4,2444.210152
河北省,邯郸市魏县双井镇双井村,魏县双井镇董圈村,13040115,2014/5/18 9:36,2014/5/18 0:00,中国银行,257,317218.25,1234.312257
河北省,石家庄市井陉县上安镇白王庄村,井陉上安镇白王庄村,13010073,2014/5/21 10:02,,中国银行,751,2536546,3377.557923
河北省,沧州市青县金牛镇打虎庄村,青县金牛镇打虎庄村,13090133,2014/5/22 23:24,2014/3/11 0:00,中国银行,187,1433385.9,7665.165241
河北省,沧州市河间市尊祖庄乡高王化村,河间市尊祖庄乡高王化村,13090134,2014/5/22 23:26,2014/3/19 0:00,中国银行,269,2154023.8,8007.52342
河北省,沧州市河间市黎民居乡李召庄村,河间市黎民居乡李召庄村,13090135,2014/5/22 23:38,,中国银行,119,3673756.5,30871.90336
河北省,沧州市沧县崔尔庄镇北村,沧州市杜林镇杜林北街,13090136,2014/5/22 0:00,,中国银行,247,2051320.1,8304.939676
河北省,张家口市万全县洗马林镇万全县洗马林镇,万全县洗马林镇洗马林村,13070037,2014/5/23 11:36,,中国银行,461,3460716,7506.976139
河北省,张家口市蔚县代王城镇蔚县代王城镇富家堡村,蔚县代王城镇富家堡村,13070038,2014/5/23 11:59,,中国银行,96,51588.51,537.380313
贵州省,贵阳市白云区艳山红镇程官村,程官村,52010001,2014/5/24 16:20,2014/12/25 0:00,贵阳银行,0,0,\N
河北省,沧州市黄骅市羊二庄回族乡八里庄村,黄骅市羊二庄镇八里庄村,13090140,2014/5/24 0:00,,中国银行,717,6344630,8848.856346
河北省,邯郸市磁县岳城镇岳城村,磁县岳城镇岳城村,13040117,2014/5/27 20:49,2014/6/27 0:00,中国银行,148,3056015.8,20648.75541
河北省,沧州市吴桥县梁集镇北徐王村,吴桥县梁集镇北徐王村,13090142,2014/5/28 15:46,2014/6/3 0:00,中国银行,441,2017250.9,4574.265079
河北省,承德市围场满族蒙古族自治县龙头山乡大字村,围场县龙头山乡大字村(金融）,13080002,2014/5/29 10:27,2014/5/2 0:00,中国银行,178,2893909.5,16257.91854
河北省,唐山市迁西县三屯营镇西龙湾村,迁西三屯西龙湾村,13020008,2014/5/29 10:46,2014/5/30 0:00,中国银行,369,2653243,7190.360434
河北省,衡水市桃城区大麻森乡花园村,麻森乡花园村,13110179,2014/6/3 17:12,2014/6/5 0:00,中国银行,258,1474463.1,5714.973256
河北省,衡水市深州市大堤镇北尚庄村,大屯镇北尚庄,13110180,2014/6/4 18:55,,中国银行,331,7464180.5,22550.39426
河北省,承德市宽城满族自治县峪耳崖镇双洞子,宽城县峪耳崖镇双洞子村,13080004,2014/6/4 22:01,2014/6/17 0:00,中国银行,237,455222.66,1920.770717
河北省,衡水市冀州市西王镇五分村,西王镇五分村,13110181,2014/6/4 23:20,,中国银行,247,1489305.2,6029.575709
河北省,衡水市桃城区郑家河沿镇三杜庄村,河沿镇三杜庄村,13110182,2014/6/5 22:03,2014/6/6 0:00,中国银行,339,3376232.8,9959.388791
河北省,石家庄市辛集市新垒头镇摇头村,辛集市新垒头乡摇头村,13010074,2014/6/7 0:00,,中国银行,173,4646236.5,26856.85838
河北省,沧州市吴桥县桑园镇林庄,任丘市林庄村,13090143,2014/6/7 13:36,,中国银行,489,8640252,17669.22699
河北省,张家口市怀来县沙城镇怀来县东水泉村,怀来县沙城镇东水泉村,13070039,2014/6/8 0:00,,中国银行,424,2267140.8,5347.030189
河北省,承德市隆化县韩麻营镇北沟村,隆化县韩麻营镇北沟村,13080005,2014/6/9 0:00,,中国银行,223,8149258.5,36543.76009
河北省,沧州市南皮县冯家口镇冯家口村,南皮县冯家口镇冯家口村,13090144,2014/6/9 16:46,,中国银行,218,3349103,15362.8578
河北省,衡水市桃城区衡水高新技术产业开发区衡水市桃城区志平日用百货商店,衡水市桃城区志平日用百货商店,13110184,2014/6/11 17:32,,中国银行,250,1221305.5,4885.222
河北省,衡水市武邑县韩庄镇东粉张村,韩庄镇东粉张村,13110185,2014/6/11 20:20,,中国银行,135,681876.94,5050.940296
河北省,沧州市河间市沙洼乡五家务村,河间市沙洼乡五家务村,13090145,2014/6/17 21:19,2014/3/11 0:00,中国银行,69,7554989,109492.5942
河北省,承德市平泉县党坝镇党坝村,平泉县党坝镇党坝村,13080006,2014/6/17 22:40,,中国银行,178,1280632.2,7194.562921
河北省,唐山市丰南区南孙庄乡薛家,唐山市丰南区南孙庄乡薛家村,13020010,2014/6/19 10:55,,中国银行,0,0,\N
河北省,承德市兴隆县蘑菇峪乡宋杖子,兴隆县蘑菇峪乡宋杖子村,13080008,2014/6/20 0:10,2014/10/17 0:00,中国银行,195,1464182.6,7508.628718
河北省,衡水市桃城区郑家河沿镇北沼村,桃城区郑家河沿镇北沼村,13110186,2014/6/20 18:46,,中国银行,100,3173664.8,31736.648
河北省,张家口市蔚县代王城镇蔚县代王城镇,代王城镇便民服务中心,13070041,2014/6/21 17:26,,中国银行,53,537338.94,10138.47057
河北省,张家口市万全县郭磊庄镇万全县丰胜庄村,万全县郭磊庄镇丰胜庄村,13070043,2014/6/21 18:05,,中国银行,485,4509683.5,9298.316495
河北省,衡水市安平县东黄城乡西候疃村,东黄城乡西侯疃村,13110187,2014/6/23 10:02,2014/6/23 0:00,中国银行,139,3673122.2,26425.33957
河北省,承德市兴隆县六道河镇二道河,兴隆县六道河镇二道河村安营寨,13080011,2014/6/23 12:33,2014/7/4 0:00,中国银行,241,12188346,50574.04979
河北省,承德市双滦区双塔山镇烧锅村,双滦区西地满族乡烧锅村,13080014,2014/6/23 12:53,,中国银行,318,2287590,7193.679245
河北省,承德市双滦区偏桥子镇前营子村,双滦区偏桥子镇前营子村,13080015,2014/6/23 12:55,2014/8/1 0:00,中国银行,157,469281.94,2989.056943
河北省,承德市兴隆县蘑菇峪乡宽甸村,兴隆县蘑菇峪乡宽店村,13080016,2014/6/23 23:35,2014/10/17 0:00,中国银行,229,3116712.2,13610.09694
河北省,承德市滦平县张百湾镇偏道子村,滦平县张百湾镇偏道子村,13080017,2014/6/25 22:02,2014/8/4 0:00,中国银行,291,1085178.1,3729.134364
河北省,承德市隆化县汤头沟镇小汤头沟村,隆化县汤头沟镇小汤头沟村,13080019,2014/6/25 22:10,,中国银行,90,1147077.2,12745.30222
河北省,承德市平泉县卧龙镇沙坨子,平泉县卧龙镇沙坨子村,13080020,2014/6/25 22:16,,中国银行,215,698697.5,3249.755814
河北省,承德市承德县上板城镇老爷庙村,高新区上板城镇老爷庙村,13080021,2014/6/25 22:19,2014/7/27 0:00,中国银行,352,1718892.1,4883.216193
河北省,承德市承德县高寺台镇东营村,高新区冯营子镇东营村,13080023,2014/6/25 0:00,,中国银行,232,4264402.5,18381.04526
河北省,邯郸市邯郸县尚璧镇西孙庄,邯郸县尚璧镇西孙庄村,13040122,2014/6/26 13:42,,中国银行,376,5414040.5,14399.04388
河北省,张家口市怀来县狼山乡怀来县奚家堡村,怀来县狼山乡奚家堡村助农取款点王殿霞,13070044,2014/6/26 0:00,,中国银行,209,206600.53,988.519282
河北省,张家口市怀来县北辛堡镇怀来县方家冲村,怀来县北辛堡镇方家冲村助农取款点解建国,13070045,2014/6/26 0:00,,中国银行,172,2470162.5,14361.40988
河北省,邯郸市永年县东杨庄乡茹佐村,永年县东杨庄乡茹佐村,13040125,2014/6/29 13:11,,中国银行,327,2181102.5,6670.038226
河北省,衡水市安平县东黄城乡台城村,黄城乡台城村,13110189,2014/6/30 8:33,,中国银行,411,4530299,11022.6253
河北省,承德市双滦区偏桥子镇偏桥子村,双滦区偏桥子镇偏桥子村,13080024,2014/6/30 17:53,2014/8/21 0:00,中国银行,361,4912469.5,13607.94875
贵州省,贵阳市清镇市红枫湖镇芦荻哨村,芦荻哨村,52010002,2014/7/1 11:55,2014/6/30 0:00,贵阳银行,0,0,\N
河北省,衡水市景县龙华镇南文柯村,景县龙华镇南文柯村,13110190,2014/7/2 17:45,,中国银行,633,1537153.9,2428.363191
河北省,唐山市滦县古马镇南张庄子村,滦县古马镇南张庄子村,13020011,2014/7/4 11:14,2014/7/4 0:00,中国银行,233,7733030,33188.96996
河北省,衡水市深州市兵曹乡邵浦村,兵曹乡邵甫村,13110191,2014/7/7 18:10,,中国银行,302,1918387.9,6352.277815
河北省,衡水市冀州市南午村镇西古头村,南午村镇西古头村,13110192,2014/7/7 18:19,,中国银行,312,3865381.8,12389.04423
河北省,邯郸市成安县商城镇何横城村,成安县商城镇何横城村,13040126,2014/7/9 10:02,,中国银行,397,1363523.6,3434.568262
河北省,唐山市滦县王店子镇研山新村,滦县响堂新村,13020012,2014/7/10 10:59,2014/7/10 0:00,中国银行,721,6514467.5,9035.322469
河北省,沧州市海兴县小山乡海兴县小山乡付庄子村,海兴县小山乡付庄子村,13090146,2014/7/10 15:35,,中国银行,133,794846.44,5976.289023
河北省,衡水市饶阳县王同岳乡杨池村,饶阳县同岳乡杨池村,13110194,2014/7/12 14:30,,中国银行,30,993788.6,33126.28667
河北省,沧州市河间市尊祖庄乡杨营村,河间市尊祖庄乡杨营村,13090147,2014/7/13 13:16,,中国银行,480,1731284.4,3606.8425
河北省,秦皇岛市青龙满族自治县青龙镇青龙县逃军山村,青龙县逃军山村,13030001,2014/7/14 14:14,,中国银行,302,9216749,30519.03642
河北省,衡水市安平县大何庄乡杨各庄村,大何庄乡杨各庄村,13110195,2014/7/14 22:22,2014/7/15 0:00,中国银行,62,210745.3,3399.117742
贵州省,贵阳市白云区艳山红镇茶饭村,茶饭村,52010003,2014/7/16 9:47,2014/8/18 0:00,贵阳银行,0,0,\N
贵州省,安顺市平坝县羊昌布依族苗族乡云头村,云平坝县云头村,52040001,2014/7/16 0:00,,平坝鼎立村镇银行,0,0,\N
河北省,唐山市遵化市刘备寨乡科道屯,遵化市刘备寨乡科道屯村,13020014,2014/7/17 8:00,,中国银行,166,5617283.5,33839.05723
河北省,唐山市丰润区石各庄镇三女河,空港城高新区三女河村,13020015,2014/7/21 10:43,,中国银行,436,2403162.8,5511.841284
河北省,唐山市丰润区丰润镇高各庄,丰润区丰润镇高各庄,13020016,2014/7/21 22:58,,中国银行,260,4303505,16551.94231
河北省,唐山市丰润区丰润镇压库山村,丰润区丰润镇压库山村,13020017,2014/7/21 23:01,2014/7/22 0:00,中国银行,358,6021219,16819.04749
河北省,唐山市玉田县大安镇大庞各庄村,玉田县大安镇大庞各庄村,13020018,2014/7/22 20:06,,中国银行,616,4979934,8084.308442
河北省,唐山市玉田县玉田镇碱厂村,玉田县陈家铺乡碱场村,13020019,2014/7/22 20:07,,中国银行,566,5581092,9860.586572
河北省,衡水市饶阳县东里满乡张各庄村,饶阳县东里满乡张各庄村,13110196,2014/7/23 10:02,,中国银行,161,300427.12,1866.006957
河北省,唐山市迁安市迁安镇三李庄村,迁安市迁安镇三李庄村,13020021,2014/7/23 10:03,2014/7/23 0:00,中国银行,189,1920135.1,10159.44497
贵州省,贵阳市清镇市麦格苗族布依族乡长冲村,长冲村,52010004,2014/7/24 9:09,2014/10/28 0:00,贵阳银行,0,0,\N
河北省,衡水市枣强县枣强镇枣强县枣强镇杜烟村,枣强县枣强镇杜烟村,13110197,2014/7/24 0:00,,中国银行,1554,2122448.8,1365.797169
河北省,承德市承德县上板城镇白河南村,高新区上板城镇白河南村,13080025,2014/7/24 22:00,2014/8/13 0:00,中国银行,532,3874139,7282.216165
河北省,张家口市万全县北沙城乡万全县岸庄屯村,北沙城乡岸庄屯村,13070047,2014/7/25 15:12,,中国银行,391,1974193.1,5049.087212
河北省,张家口市万全县安家堡乡万全县第七屯,万全县安家堡乡第七屯村,13070049,2014/7/25 15:46,,中国银行,235,323008.12,1374.502638
河北省,唐山市迁西县新集镇一村,迁西县太平寨一村,13020022,2014/7/25 23:00,,中国银行,175,653270.1,3732.972
河北省,唐山市丰润区任各庄镇后泥河村,丰润区任各庄镇后泥河村,13020024,2014/7/27 22:47,,中国银行,244,2757883,11302.79918
河北省,唐山市丰润区白官屯镇田富庄,丰润区白官屯镇田富庄村,13020027,2014/7/27 22:58,,中国银行,238,1531450.2,6434.664706
河北省,唐山市丰润区丰润镇芦各庄,丰润区丰润镇芦各庄,13020028,2014/7/27 23:00,,中国银行,171,2423646.8,14173.3731
河北省,唐山市丰润区白官屯镇史庄子,丰润区白官屯镇史庄子村,13020029,2014/7/27 23:04,,中国银行,337,3923083,11641.19585
河北省,张家口市宣化区庞家堡镇宣化县梅家营村,宣化县大仓盖镇梅家营村,13070050,2014/7/28 0:00,,中国银行,194,736123,3794.448454
河北省,唐山市丰润区老庄子镇瓦房庄,高新技术开发区老庄子镇瓦房庄村,13020030,2014/7/28 0:00,,中国银行,0,0,\N
河北省,唐山市遵化市候家寨乡前后杖子村,遵化市侯家寨乡前后杖子村,13020031,2014/7/28 19:28,,中国银行,385,1382954.1,3592.088571
河北省,衡水市深州市深州镇利仁村,深州镇利仁村,13110198,2014/7/28 21:43,,中国银行,329,1878948.1,5711.08845
河北省,衡水市桃城区大麻森乡河沿村,河沿镇河沿村,13110199,2014/7/28 0:00,,中国银行,327,4671155.5,14284.87921
河北省,衡水市武邑县肖桥头镇大白塔村,桥头镇大白塔村,13110200,2014/7/28 21:58,,中国银行,245,978509.44,3993.916082
河北省,衡水市武邑县清凉店镇李周村,武邑县清凉店镇李周村,13110203,2014/7/28 22:10,,中国银行,127,326279.75,2569.13189
河北省,承德市双滦区双塔山镇周台子村,双滦区张百湾镇周台子村,13080028,2014/7/28 23:26,2014/8/13 0:00,中国银行,1426,3980737,2791.540673
河北省,沧州市青县金牛镇大勃鸽留村,青县金牛镇大勃鸽留村,13090148,2014/7/29 13:36,,中国银行,340,1923775.5,5658.163235
贵州省,贵阳市白云区牛场布依族乡石头村,石头村,52010005,2014/7/29 15:55,2014/9/11 0:00,贵阳银行,0,0,\N
河北省,承德市丰宁满族自治县凤山镇朱首营村,丰宁满族自治县凤山镇朱首营村,13080029,2014/7/29 23:14,,中国银行,334,1014651.06,3037.877425
河北省,承德市隆化县八达营蒙古族乡下牛录村,隆化县八达营乡下牛录村,13080031,2014/7/29 23:40,2014/9/5 0:00,中国银行,191,2482435.8,12997.04607
河北省,承德市隆化县蓝旗镇黑山嘴村,隆化县蓝旗镇黑山嘴村,13080032,2014/7/29 0:00,,中国银行,195,1016334.44,5211.971487
河北省,承德市隆化县蓝旗镇北窝铺村,隆化县蓝旗镇北窝铺村,13080033,2014/7/29 23:45,,中国银行,202,1121290.6,5550.943564
河北省,衡水市武强县街关镇东南街村,衡水武强县街关镇东南街村,13110205,2014/7/30 18:27,2014/8/1 0:00,中国银行,1027,6812810,6633.700097
河北省,衡水市武强县武强镇马头村,衡水武强县武强镇马头村,13110206,2014/7/30 18:34,,中国银行,358,585969.4,1636.786034
河北省,唐山市迁安市蔡园镇北屯,迁安市蔡园镇北屯村,13020032,2014/7/31 10:13,2014/7/31 0:00,中国银行,229,1416491.1,6185.550655
河北省,沧州市沧县大褚村回族乡沧县大褚村乡何陈庄村,沧县大褚村乡何陈庄村,13090149,2014/7/31 0:00,,中国银行,173,9364425,54129.62428
河北省,沧州市沧县杜生镇沧县杜生镇,沧县杜生镇杜乜村,13090150,2014/8/1 0:00,,中国银行,133,1404454.8,10559.81053
河北省,唐山市滦县雷庄镇雷庄,滦县雷庄镇雷庄村,13020033,2014/8/1 10:06,2014/8/1 0:00,中国银行,269,274759.6,1021.411152
河北省,石家庄市赵县前大章乡史家庄,赵县前大章乡史家庄村,13010075,2014/8/1 13:56,2014/8/1 0:00,中国银行,504,3674875.5,7291.419643
河北省,唐山市迁安市杨各庄镇森罗寨,迁安市杨各庄镇森罗寨村,13020036,2014/8/2 13:24,2014/7/30 0:00,中国银行,116,34172.29,294.588707
河北省,承德市兴隆县兴隆镇小河南村,兴隆县兴隆镇小河南村,13080037,2014/8/2 13:30,,中国银行,236,4258267.5,18043.50636
河北省,唐山市迁安市蔡园镇李庄子,迁安市蔡园镇李庄子村,13020037,2014/8/2 13:31,2014/7/18 0:00,中国银行,455,8373167,18402.56484
河北省,唐山市滦县古马镇塘坨,滦县古马镇塘坨村,13020038,2014/8/2 13:36,2014/8/7 0:00,中国银行,240,3725566.8,15523.195
河北省,邢台市隆尧县千户营乡苏家庄,隆尧县千户营乡苏家庄村,13050004,2014/8/4 15:57,,中国银行,591,4856798,8217.932318
河北省,衡水市安平县西两洼乡后铺村,两洼乡后铺村,13110207,2014/8/4 17:03,,中国银行,150,511029.3,3406.862
河北省,衡水市安平县程油子乡张庄村,油子乡张庄村,13110208,2014/8/4 17:52,,中国银行,26,60026,2308.692308
河北省,邢台市沙河市赞善街道办事处下郑村,沙河市赞善办事处下郑村,13050005,2014/8/4 19:39,,中国银行,487,16707232,34306.43121
河北省,衡水市饶阳县王同岳乡横头村,饶阳县同岳乡横头村,13110209,2014/8/4 20:58,,中国银行,51,591222.25,11592.59314
河北省,邢台市沙河市蝉房乡温家沟村,沙河市蝉房乡五里沟,13050006,2014/8/5 16:47,,中国银行,522,2887195.5,5531.025862
河北省,张家口市涿鹿县东小庄乡涿鹿县双树村,涿鹿县东小庄镇双树村,13070052,2014/8/5 20:52,,中国银行,1442,2118408,1469.076283
河北省,张家口市涿鹿县张家堡镇涿鹿县曹堡村,涿鹿县张家堡镇曹堡村,13070053,2014/8/5 20:56,,中国银行,227,370131.6,1630.535683
河北省,邢台市内邱县官庄镇官庄二村,内丘县官庄镇官二村,13050007,2014/8/6 16:49,,中国银行,474,3657294,7715.810127
河北省,沧州市泊头市文庙镇扁渡里,泊头市文庙镇扁渡里村,13090151,2014/8/8 11:18,,中国银行,251,2095822.9,8349.892032
河北省,沧州市南皮县潞灌乡旁堤刘,南皮县潞灌乡旁堤刘村,13090152,2014/8/8 16:56,,中国银行,475,5668836.5,11934.39263
河北省,衡水市饶阳县王同岳乡程各庄村,饶阳县同岳乡程各庄,13110210,2014/8/8 21:01,,中国银行,212,657076.56,3099.417736
河北省,石家庄市平山县岗南镇马冢村,平山县温塘镇北马中村,13010077,2014/8/9 9:27,,中国银行,407,2083681.1,5119.609582
河北省,石家庄市深泽县赵八乡西大陈村,深泽县赵八乡西大陈村,13010078,2014/8/9 9:41,,中国银行,155,977329.75,6305.353226
河北省,石家庄市深泽县桥头乡堤北村,深泽县桥头乡堤北村,13010079,2014/8/9 9:51,,中国银行,628,3701785,5894.562102
河北省,石家庄市深泽县白庄乡大直要村,深泽县白庄乡大直要村,13010080,2014/8/9 9:59,,中国银行,367,1694993.5,4618.510899
河北省,石家庄市辛集市田家庄乡旧寨村,辛集市田家庄乡旧寨村,13010083,2014/8/9 11:12,,中国银行,0,0,\N
河北省,石家庄市元氏县赵同乡井下村,元氏县赵同乡井下村,13010084,2014/8/9 0:00,,中国银行,380,3410227.5,8974.282895
河北省,石家庄市元氏县北褚乡西贾村,元氏县北褚乡西贾村,13010086,2014/8/9 0:00,,中国银行,284,1631862.1,5745.99331
河北省,石家庄市赵县南柏舍镇唐家寨村,赵县南柏舍镇唐家寨村,13010088,2014/8/9 11:42,,中国银行,363,3729992.2,10275.46061
河北省,石家庄市赵县新寨店镇北轮城村,赵县新寨店镇北轮城村,13010089,2014/8/9 14:17,,中国银行,279,2488182.5,8918.216846
河北省,石家庄市正定县新城铺镇北王庄村,正定县新城铺镇北王庄村,13010090,2014/8/9 0:00,,中国银行,279,2103151.2,7538.176344
河北省,唐山市迁西县滦阳镇夏家峪,迁西县滦阳镇夏家峪村,13020041,2014/8/10 16:27,,中国银行,545,2617260.8,4802.313394
河北省,承德市兴隆县李家营乡苗家营村,兴隆县李家营乡苗家营村,13080038,2014/8/10 0:00,,中国银行,215,1495297.4,6954.871628
河北省,秦皇岛市山海关区石河镇山海关石河镇田庄,山海关石河镇田庄,13030002,2014/8/11 10:52,,中国银行,128,2092128.9,16344.75703
河北省,唐山市滦南县城镇东上坡子,滦南县奔城镇东上坡子村,13020042,2014/8/11 11:34,,中国银行,211,5780915.5,27397.70379
河北省,唐山市滦南县姚王庄镇姚王庄,滦南县姚王庄镇,13020043,2014/8/11 11:41,,中国银行,420,24657996,58709.51429
河北省,唐山市滦南县胡各庄镇胡各庄村,滦南县胡各庄镇,13020044,2014/8/11 11:48,,中国银行,207,4133524.8,19968.71884
河北省,唐山市滦南县方各庄镇魏各庄村,滦南县方各庄镇魏各庄村,13020045,2014/8/11 11:56,,中国银行,102,1997412.6,19582.47647
河北省,唐山市乐亭县王滩镇曹庄村,乐亭县王滩镇曹庄,13020046,2014/8/11 12:11,,中国银行,636,2358658.2,3708.582075
河北省,唐山市乐亭县乐亭镇高甸村,乐亭县乐亭镇西高甸村,13020047,2014/8/11 12:16,,中国银行,288,2140143,7431.052083
河北省,承德市围场满族蒙古族自治县围场镇金字村,围场县围场镇金字村,13080039,2014/8/11 15:58,,中国银行,166,4067535.8,24503.22771
河北省,邢台市沙河市桥东街道办事处杜村,沙河市桥东办事处杜村,13050008,2014/8/11 16:18,,中国银行,377,2469828,6551.267905
河北省,衡水市饶阳县大官亭乡徐庄村,饶阳县官亭镇徐庄村,13110211,2014/8/11 16:54,,中国银行,233,2213280.8,9499.059227
河北省,承德市双桥区冯营子镇干沟子村,双桥区双峰寺镇甘沟子村,13080040,2014/8/11 0:00,,中国银行,177,19606204,110769.5141
河北省,承德市滦平县滦平镇西台子村,滦平县滦平镇西台子村,13080041,2014/8/11 22:14,,中国银行,393,290586.5,739.405852
河北省,承德市隆化县汤头沟镇四十家子,隆化县汤头沟镇四十家子村,13080042,2014/8/11 0:00,,中国银行,110,984258.4,8947.803636
河北省,石家庄市赵县高村乡北王村,赵县高村乡北王村,13010091,2014/8/13 11:35,2014/8/13 0:00,中国银行,241,908226.5,3768.574689
河北省,沧州市黄骅市吕桥镇黄骅市吕桥镇何桥村,黄骅市吕桥镇何桥村,13090153,2014/8/14 0:00,,中国银行,229,1227168.2,5358.8131
河北省,石家庄市赵县范庄镇南庄村,赵县范庄镇南庄村,13010093,2014/8/14 10:24,,中国银行,816,5012970,6143.345588
河北省,秦皇岛市昌黎县荒佃庄乡荒佃庄村,昌黎县荒佃庄镇荒佃庄村,13030005,2014/8/15 7:46,,中国银行,278,404396.4,1454.663309
河北省,秦皇岛市山海关区孟姜镇大毛山村,山海关大毛山村,13030007,2014/8/15 8:38,,中国银行,199,596240.1,2996.181407
河北省,秦皇岛市抚宁县留守营镇刘义庄村,留守营镇刘义庄村,13030008,2014/8/15 0:00,,中国银行,315,332143.53,1054.423905
河北省,秦皇岛市北戴河区戴河镇西坨头村,北戴河戴河镇西坨头村,13030009,2014/8/15 9:08,,中国银行,195,2331644,11957.14872
河北省,邢台市隆尧县大张庄乡黄家庄,隆尧县大张庄乡黄家庄村,13050009,2014/8/15 19:11,,中国银行,809,5182563,6406.134734
甘肃省,兰州市城关区青白石街道白道坪村,白道坪村,62010001,2014/8/15 20:27,,中国银行,101,6484228.5,64200.28218
河北省,沧州市黄骅市南排河镇西高头,黄骅市南排河镇西高头村,13090154,2014/8/18 0:00,,中国银行,464,14080401,30345.69181
河北省,石家庄市辛集市王口镇北汉口,辛集市王口镇北汉口村,13010094,2014/8/20 9:13,,中国银行,283,2879122.2,10173.57668
河北省,石家庄市晋州市东里庄乡南寺闾,晋州市东里庄镇南寺闾村,13010095,2014/8/20 9:50,,中国银行,224,225179.44,1005.265357
河北省,石家庄市晋州市东卓宿镇陈家庄,晋州市东卓宿镇陈家庄村,13010096,2014/8/20 9:58,,中国银行,549,3162449.8,5760.382149
河北省,石家庄市无极县北苏镇北苏村,无极县北苏镇北苏村李会荣助农点,13010097,2014/8/20 9:59,,中国银行,711,3397142,4777.977496
河北省,石家庄市晋州市营里镇营里村,晋州市营里镇营里村,13010098,2014/8/20 10:05,,中国银行,334,2041111.1,6111.111078
河北省,石家庄市无极县郭庄镇陈村,无极县郝庄乡东陈村助农点,13010099,2014/8/20 10:05,,中国银行,371,3128099,8431.533693
河北省,石家庄市平山县苏家庄乡缑家庄村,平山县苏家庄乡缑家庄村,13010101,2014/8/20 10:17,,中国银行,209,578654.06,2768.679713
河北省,石家庄市平山县宅北乡寨北村,平山县寨北乡寨北村,13010103,2014/8/20 10:22,,中国银行,0,0,\N
河北省,石家庄市藁城市贾市庄镇贾庄村,藁城区贾市庄镇贾庄村,13010107,2014/8/20 10:49,,中国银行,629,1166635.5,1854.746423
河北省,石家庄市藁城市南孟镇韩家洼,藁城区南董镇韩家洼村,13010108,2014/8/20 10:52,,中国银行,538,4535170,8429.684015
河北省,石家庄市鹿泉市石井乡栈道村,鹿泉区石井乡栈道村,13010110,2014/8/20 10:58,,中国银行,131,15774655,120417.2137
河北省,石家庄市赵县新寨店镇北正村,赵县新寨店镇北正村,13010111,2014/8/20 11:10,,中国银行,130,670893,5160.715385
河北省,石家庄市鹿泉市上庄镇大车行村,鹿泉区上庄镇大车行村,13010113,2014/8/20 11:26,,中国银行,0,0,\N
河北省,石家庄市鹿泉市铜冶镇南甘子村,鹿泉市铜冶镇南甘子村,13010114,2014/8/20 0:00,,中国银行,181,1051631,5810.116022
河北省,石家庄市赵县沙河店镇杨户村,赵县范庄镇杨户村,13010115,2014/8/20 11:32,,中国银行,340,1368891.2,4026.150588
河北省,石家庄市赵县南柏舍镇北柏舍村,赵县南柏舍镇北柏舍村,13010117,2014/8/20 11:37,,中国银行,276,3141743,11383.12681
河北省,石家庄市鹿泉市获鹿镇东焦村,鹿泉区宜安镇东焦村,13010118,2014/8/20 11:44,,中国银行,291,945156.2,3247.95945
河北省,石家庄市赵县新寨店镇曹谷疃村,赵县新寨店镇曹谷疃村,13010119,2014/8/20 11:45,,中国银行,558,5857480,10497.27599
