省,村名,站点,编号,签约时间,开业时间,银行,卡数,存款数,卡均
河北省,石家庄市元氏县东张乡大陈庄村,元氏县东张乡大陈庄,13010181,2015/1/5 16:41,2015/1/5 16:41,中国银行,304,2100000,6907.894737
河南省,商丘市柘城县岗王乡岗王村,柘城县岗王乡岗王村助农服务取款点,41140550,2015/1/5 16:41,2015/1/5 16:41,中国银行,491,302247.73,615.575825
山东省,烟台市蓬莱市新港街道许马村,烟台市蓬莱市村里集镇村里集村助农服务点,37060239,2015/1/5 16:42,2015/1/5 16:42,中国银行,53,50005.2,943.49434
甘肃省,庆阳市西峰区董志镇周岭村,董志镇周岭村,62100002,2015/1/5 16:43,2015/1/5 16:43,中国银行,164,1930345.41,11770.39884
山东省,烟台市蓬莱市村里集镇巩家村,巩家村,37060240,2015/1/5 16:45,2015/1/5 16:45,中国银行,0,0,\N
河南省,商丘市夏邑县韩道口镇韩西村,夏邑县韩西镇韩西村惠农支付服务点,41140554,2015/1/5 16:45,2015/1/5 16:45,中国银行,184,64064.64,348.177391
山东省,烟台市蓬莱市大辛店镇东黄家村,烟台市蓬莱市大辛店镇东黄家村助农服务点,37060241,2015/1/5 16:47,2015/1/5 16:47,中国银行,102,14850441.86,145592.5673
河南省,商丘市柘城县胡襄镇北街村,柘城县洪恩乡洪恩村助农服务取款点,41140555,2015/1/5 16:47,2015/1/5 16:47,中国银行,425,123637.02,290.910635
河南省,商丘市夏邑县火店乡班集村,夏邑县火店乡班集村惠农服务支付网点,41140556,2015/1/5 16:48,2015/1/5 16:48,中国银行,136,152121.59,1118.541103
山东省,烟台市蓬莱市登州街道东城住宅小区社区,和谐小区,37060242,2015/1/5 16:50,2015/1/5 16:50,中国银行,0,0,\N
河南省,商丘市夏邑县车站镇秦集村,夏邑县车站镇吴寨村惠农支付服务点,41140557,2015/1/5 16:50,2015/1/5 16:50,中国银行,119,94602.3,794.977311
甘肃省,庆阳市西峰区温泉乡刘家店村,刘店村富智超市,62100003,2015/1/5 16:50,2015/1/5 16:50,中国银行,223,2338493.84,10486.51946
山东省,潍坊市潍城区西关街道办事处南小圩河,南小于河,37070088,2015/1/5 16:50,2015/1/5 16:50,工商银行,521,11610525.84,22285.07839
山东省,烟台市蓬莱市新港街道湾子口村,湾子口村,37060243,2015/1/5 16:52,2015/1/5 16:52,中国银行,0,1223565,\N
河南省,商丘市夏邑县车站镇牛王固村,夏邑车站镇牛王卮寤菖┲Ц斗务点,41140560,2014/12/16 0:00,2015/1/5 16:53,中国银行,621,6623605.54,10666.03147
河北省,廊坊市大城县摩配园区管委会东阜村,大城县工业园区东阜村,13100026,2015/1/5 0:00,2015/1/5 0:00,中国银行,724,23070000,31864.64088
甘肃省,庆阳市西峰区后官寨乡李庄村,后官寨乡李庄村,62100004,2015/1/5 16:55,2015/1/5 16:55,中国银行,286,2527116.02,8836.07
河南省,商丘市柘城县远襄镇西街村,柘城县远襄镇西街助农服务取款点,41140561,2015/1/10 0:00,2015/1/5 16:55,中国银行,679,5003350.74,7368.705066
山东省,潍坊市潍城区望留镇河湾村,西河湾村,37070090,2015/1/5 16:55,2015/1/5 16:55,工商银行,90,733403.46,8148.927333
山东省,烟台市蓬莱市登州街道东城住宅小区社区,环峰小区,37060244,2015/1/5 16:56,2015/1/5 16:56,中国银行,0,0,\N
山东省,济南市章丘市普集镇小柏村,山东省济南市章丘市普集镇小柏村,37010216,2015/1/5 16:57,2015/1/5 16:57,中国银行,0,0,\N
山东省,威海市环翠区凤林街道办事处西山口村,西山口村,37100013,2015/1/5 16:57,2015/1/5 16:57,中国银行,0,0,\N
山东省,烟台市蓬莱市南王街道南八甲村,南八甲村,37060245,2015/1/5 16:58,2015/1/5 16:58,中国银行,0,0,\N
山东省,烟台市蓬莱市北沟镇栾家口村,烟台市蓬莱市北沟栾家口村助农服务点,37060246,2015/1/5 17:00,2015/1/5 17:00,中国银行,109,41224.42,378.205688
河南省,商丘市夏邑县马头镇北刘楼村,夏邑县北岭镇刘园村惠农支付服务点,41140564,2014/11/16 0:00,2015/1/5 17:02,中国银行,745,4390652.36,5893.493101
甘肃省,庆阳市西峰区肖金镇芮岭村,肖金镇芮岭村,62100005,2015/1/5 17:02,2015/1/5 17:02,中国银行,314,2530166.23,8057.854236
河南省,商丘市夏邑县李集镇郭庄村,夏邑李集镇郭庄村惠农支付服务点,41140565,2015/1/5 17:04,2015/1/5 17:04,中国银行,304,823004.34,2707.251118
河南省,商丘市柘城县牛城乡牛城村,柘城县牛城乡南街助农服务取款点,41140566,2014/11/21 0:00,2015/1/5 17:05,中国银行,995,2560960.68,2573.829829
河南省,商丘市夏邑县歧河乡响铃寺村,夏邑刘店集乡孔祠村惠农支付服务点,41140567,2015/1/5 17:06,2015/1/5 17:06,中国银行,655,3107447.36,4744.194443
河南省,商丘市夏邑县车站镇车站村,夏邑县车站镇车站村惠农支付服务点,41140568,2015/1/5 17:09,2015/1/5 17:09,中国银行,523,1383705.19,2645.70782
山东省,烟台市蓬莱市大辛店镇回家村,回村,37060248,2015/1/5 17:09,2015/1/5 17:09,中国银行,0,0,\N
河南省,商丘市柘城县老王集乡西街村,柘城县马集乡马集村助农服务取款点,41140569,2015/1/5 17:10,2015/1/5 17:10,中国银行,321,5356.74,16.687664
山东省,烟台市蓬莱市大辛店镇龙山店村,烟台市蓬莱市大辛店镇龙山店村助农服务点,37060249,2015/1/5 17:11,2015/1/5 17:11,中国银行,100,2419514.07,24195.1407
山东省,烟台市栖霞市亭口镇占疃村,烟台市栖霞市亭口镇占疃村助农服务点,37060250,2015/1/5 17:15,2015/1/5 17:15,中国银行,77,2468185.22,32054.35351
河南省,商丘市柘城县惠济乡刘屯村,柘城县惠济乡刘屯助农服务取款点,41140570,2015/1/5 17:15,2015/1/5 17:15,中国银行,241,255418.46,1059.827635
山东省,烟台市栖霞市蛇窝泊镇砖园村,烟台市栖霞市栖霞镇后夼村助农服务点,37060251,2015/1/5 17:16,2015/1/5 17:16,中国银行,10,2294569.44,229456.944
山东省,烟台市栖霞市松山街道东鹿头村,烟台市栖霞市松山街道东鹿头村助农服务点,37060252,2015/1/5 17:18,2015/1/5 17:18,中国银行,45,3010817.24,66907.04978
山东省,烟台市栖霞市臧家庄镇寨里村,烟台市栖霞市臧家庄镇寨里村银行卡助农取款服务点,37060253,2015/1/5 17:20,2015/1/5 17:20,中国银行,83,1389062.25,16735.68976
山东省,烟台市栖霞市官道镇官道村,烟台市栖霞市官道镇官道村助农服务点,37060254,2015/1/5 17:22,2015/1/5 17:22,中国银行,7,357519.5,51074.21429
山东省,烟台市栖霞市庄园街道北岩子口村,烟台市栖霞市庄园街道北岩口村助农服务点,37060256,2015/1/5 17:28,2015/1/5 17:28,中国银行,2,8000029.58,4000014.79
山东省,烟台市栖霞市松山街道艾山汤村,烟台市栖霞市松山街道艾山汤村助农服务点,37060257,2015/1/5 17:29,2015/1/5 17:29,中国银行,63,2864945.45,45475.3246
河南省,洛阳市偃师市山化乡山化村,洛阳市偃师县山化乡山化村惠农服务点,41030004,2014/12/26 0:00,2015/1/5 17:30,中国银行,590,2069553.37,3507.717576
山东省,烟台市栖霞市杨础镇解家沟村,烟台市栖霞市杨础镇解家沟村助农服务点,37060258,2015/1/12 0:00,2015/1/5 17:31,中国银行,110,3581222.6,32556.56909
河南省,洛阳市廛河回族区廛河回族乡马坡村,洛阳市e河区e河镇马坡村惠农服务点,41030005,2015/1/5 17:32,2015/1/5 17:32,中国银行,618,6958327.3,11259.42929
山东省,烟台市栖霞市臧家庄镇路旺村,烟台市栖霞市臧家庄镇路旺村助农服务点,37060259,2015/1/5 17:33,2015/1/5 17:33,中国银行,71,1191227.96,16777.85859
山东省,济南市长清区万德镇马场村,济南市长清区万德镇马场村助农服务点,37010238,2015/1/5 17:33,2015/1/5 17:33,中国银行,236,93967.01,398.165297
山东省,烟台市莱山区黄海路街道中国煤炭经济学院社区,烟台市莱山区院格庄镇院格庄村助农服务站,37060260,2015/1/6 0:00,2015/1/5 17:36,中国银行,779,6602415.25,8475.500963
山东省,威海市文登市张家产镇张家产村,"威海市文登县张家产镇汤村助农服务点
",37100014,2015/1/5 17:38,2015/1/5 17:38,中国银行,1,518.25,518.25
山东省,济南市长清区万德镇辛庄村,济南市长清区万德镇徐家庄村助农服务点,37010243,2015/1/5 17:40,2015/1/5 17:40,中国银行,74,365923.59,4944.913378
河南省,洛阳市洛龙区龙门镇龙门村,洛阳市高新区辛店镇柳行村惠农服务点,41030007,2014/12/30 0:00,2015/1/5 17:45,中国银行,402,1559602.27,3879.607637
山东省,威海市荣成市港西镇小西村,威海市荣成县成山卫镇小西村助农服务点,37100016,2015/1/5 17:54,2015/1/5 17:54,中国银行,8,57394.87,7174.35875
山东省,济南市长清区五峰山街道办事处东马庄村,济南市长清区五峰山街道办事处东马村助农服务点,37010249,2015/1/5 18:00,2015/1/5 18:00,中国银行,54,48262.8,893.755556
河南省,许昌市禹州市小吕乡万里马村,禹州市小吕乡万里马村,41100001,2015/1/5 18:11,2015/1/5 18:11,中国银行,220,3130424.84,14229.20382
山东省,威海市环翠区温泉镇柳林村,威海市环翠区温泉镇柳林村助农服务点,37100020,2015/1/5 18:14,2015/1/5 18:14,中国银行,52,25438.34,489.198846
山东省,威海市环翠区皇冠街道办事处沟北村,威海市经技区崮山镇沟北村助农服务点,37100022,2015/1/5 18:20,2015/1/5 18:20,中国银行,48,29127822.35,606829.6323
山东省,威海市环翠区泊于镇鲍家村,威海市泊于镇海飞游艇助农服务点,37100026,2015/1/5 18:27,2015/1/5 18:27,中国银行,82,665561.3,8116.60122
山东省,威海市荣成市人和镇北下河村,威海市荣成县人和镇北下河村助农服务点,37100027,2015/1/5 18:28,2015/1/5 18:28,中国银行,144,10891.72,75.636944
山东省,威海市荣成市虎山镇邱家村,威海市荣成市虎山镇邱家村助农服务点,37100028,2015/1/5 18:31,2015/1/5 18:31,中国银行,82,14018.27,170.954512
山东省,威海市文登市宋村镇北马村,威海市文登县宋村镇北马村助农服务点,37100029,2015/1/5 18:33,2015/1/5 18:33,中国银行,106,1638913.96,15461.45245
山东省,威海市文登市泽库镇长会口村,威海市文登县泽库镇长会口村助农服务点,37100031,2015/1/5 18:37,2015/1/5 18:37,中国银行,139,3635567.19,26155.15964
山东省,威海市文登市侯家镇崔家村,威海市文登县侯家镇崔家村助农服务点,37100032,2015/1/5 18:38,2015/1/5 18:38,中国银行,104,1171503.3,11264.45481
山东省,威海市荣成市滕家镇花园村,威海市荣成县腾家镇花园村助农服务点,37100034,2015/1/5 18:42,2015/1/5 18:42,中国银行,373,1557310.82,4175.096032
山东省,威海市文登市张家产镇董家店村,威海市文登县张家产镇董家店村助农服务点,37100035,2015/1/5 18:43,2015/1/5 18:43,中国银行,22,370179.84,16826.35636
山东省,威海市荣成市荫子镇南流水村,威海市荣成县荫子镇南流水村助农服务点,37100037,2015/1/5 18:46,2015/1/5 18:46,中国银行,2,137854.75,68927.375
山东省,威海市荣成市崖西镇林家庄村,林家庄村,37100038,2015/1/5 18:48,2015/1/5 18:48,中国银行,0,0,\N
山东省,威海市乳山市乳山口镇兰家村,威海市乳山县乳山口镇兰家村助农服务点,37100041,2015/1/5 18:52,2015/1/5 18:52,中国银行,54,7901008.01,146314.9631
山东省,威海市文登市张家产镇下冷家村,威海市文登县张家产镇下冷家村助农服务点,37100042,2015/1/5 18:52,2015/1/5 18:52,中国银行,114,85000.39,745.617456
山东省,威海市荣成市桃园街道办事处桃园村,威海市荣成县东山镇桃园村助农服务点,37100044,2015/1/5 18:56,2015/1/5 18:56,中国银行,111,1526646.38,13753.57099
山东省,威海市荣成市宁津街道办事处所前王家村,威海市荣成县宁津镇所前王家村助农服务点,37100045,2015/1/5 18:57,2015/1/5 18:57,中国银行,93,328.25,3.52957
山东省,威海市荣成市虎山镇梁家村,威海市荣成县邱家镇梁家村助农服务点,37100048,2015/1/5 19:01,2015/1/5 19:01,中国银行,12,0,0
山东省,威海市荣成市崂山街道办事处雨夼村,雨夼村,37100049,2015/1/5 19:03,2015/1/5 19:03,中国银行,0,0,\N
山东省,威海市荣成市俚岛镇草岛寨村,草岛寨村,37100050,2015/1/5 19:05,2015/1/5 19:05,中国银行,0,0,\N
山东省,威海市荣成市荫子镇前荫子夼村,威海市荣成县荫子镇前荫子村助农服务点,37100053,2015/1/5 19:11,2015/1/5 19:11,中国银行,182,1153937.82,6340.317692
河南省,濮阳市华龙区新习乡西别寨村,濮阳市新习乡西别寨村,41090001,2015/1/5 19:18,2015/1/5 19:18,中国银行,491,1134015.35,2309.603564
山东省,威海市荣成市东山街道办事处柳树村,威海市荣成县东山镇柳树集村助农服务点,37100054,2015/1/5 19:51,2015/1/5 19:51,中国银行,102,1696474.42,16632.10216
山东省,潍坊市潍城区于河镇前王村,前王村,37070097,2015/1/5 19:56,2015/1/5 19:56,工商银行,57,413899.78,7261.399649
山东省,威海市环翠区泊于镇圈于家村,威海市经技区泊于圈于家村助农服务点,37100056,2015/1/5 19:58,2015/1/5 19:58,中国银行,105,5281386.76,50298.92152
山东省,威海市环翠区泊于镇岛邓家村,威海市经技区泊于岛邓家村助农服务点,37100058,2015/1/5 20:11,2015/1/5 20:11,中国银行,51,0,0
山东省,威海市环翠区泊于镇屯钟家村,威海市经技区泊于镇屯钟家村助农服务点,37100061,2015/1/5 20:28,2015/1/5 20:28,中国银行,51,56.98,1.117255
河南省,濮阳市濮阳县清河头乡管五星村,濮阳市清河头管五星助农金融,41090003,2015/1/5 20:35,2015/1/5 20:35,中国银行,321,1128694.92,3516.183551
山东省,威海市文登市泽头镇林村,威海市文登县泽头镇林村助农服务点,37100063,2015/1/5 20:39,2015/1/5 20:39,中国银行,441,5373532.04,12184.87991
河南省,濮阳市华龙区胡村乡许村,濮阳市开州办许村助农金融,41090004,2015/1/5 20:42,2015/1/5 20:42,中国银行,819,5205674.83,6356.135324
山东省,潍坊市寒亭区双杨店镇王固庄村,王固庄村,37070106,2015/1/5 20:47,2015/1/5 20:47,工商银行,406,2953205.72,7273.905714
河南省,濮阳市濮阳县王称固乡小屯村,濮阳县王称固镇助农金融,41090005,2015/1/5 20:48,2015/1/5 20:48,中国银行,2198,12475210.12,5675.709791
山东省,威海市荣成市埠柳镇不夜村,不夜村,37100067,2015/1/5 20:50,2015/1/5 20:50,中国银行,0,0,\N
山东省,威海市荣成市崖西镇山河吕家村,山河吕家村,37100068,2015/1/5 20:51,2015/1/5 20:51,中国银行,0,0,\N
山东省,威海市荣成市成山镇成山二村,成山二村,37100071,2015/1/5 20:56,2015/1/5 20:56,中国银行,0,0,\N
山东省,威海市荣成市崖西镇大山口村,威海市荣成县崖西大山口村助农服务点,37100072,2015/1/5 20:57,2015/1/5 20:57,中国银行,102,361004.69,3539.261667
山东省,威海市荣成市滕家镇大落村,威海市荣成县滕家镇大落村助农服务点,37100074,2015/1/5 21:00,2015/1/5 21:00,中国银行,187,936574.72,5008.420963
山东省,威海市荣成市东山街道办事处柳树村,威海市荣成县东山镇柳树村助农服务点,37100075,2015/1/5 21:02,2015/1/5 21:02,中国银行,84,2292787.11,27295.08464
山东省,威海市荣成市港湾街道办事处蚧口社区,威海市荣成县石岛镇蚧口村助农服务点,37100076,2015/1/5 21:05,2015/1/5 21:05,中国银行,121,2556241.12,21125.95967
河南省,周口市郸城县胡集乡,谢竹园助农取款点,41160002,2015/1/5 21:06,2015/1/5 21:06,中国银行,490,5302746.48,10821.93159
山东省,潍坊市奎文区清池街道办事处西南段村,西南段村,37070111,2015/1/5 21:07,2015/1/5 21:07,工商银行,501,7723968.82,15417.10343
山东省,威海市荣成市桃园街道办事处上谭家村,威海市荣成县石岛镇上谭村助农服务点,37100077,2015/1/5 21:07,2015/1/5 21:07,中国银行,124,5013917.4,40434.81774
山东省,威海市荣成市人和镇朱口村,威海市荣成县人和镇朱口村助农服务点,37100078,2015/1/5 21:09,2015/1/5 21:09,中国银行,75,5952377.4,79365.032
山东省,潍坊市坊子区荆山洼镇马司三村,马司三村,37070112,2015/1/5 21:10,2015/1/5 21:10,工商银行,296,3718054.86,12560.99615
山东省,威海市荣成市人和镇人和村,威海市荣成县人和镇人和村助农服务点,37100079,2015/1/5 21:10,2015/1/5 21:10,中国银行,191,10091630.12,52835.75979
山东省,威海市荣成市上庄镇塔山村,威海市荣成县上庄镇塔山村助农服务点,37100080,2015/1/5 21:12,2015/1/5 21:12,中国银行,51,20.06,0.393333
山东省,潍坊市寒亭区朱里镇西于渠一村,西圩渠1村,37070113,2015/1/5 21:12,2015/1/5 21:12,工商银行,175,3675547.83,21003.13046
山东省,威海市荣成市滕家镇桑梓村,桑梓村,37100081,2015/1/5 21:14,2015/1/5 21:14,中国银行,0,0,\N
山东省,威海市荣成市王连街道办事处寨前方家村,威海市荣成县王连镇寨前方家村助农服务点,37100083,2015/1/5 21:17,2015/1/5 21:17,中国银行,113,3853841.76,34104.79434
山东省,潍坊市坊子区眉村镇王家庄子三村,坊子区王家庄子三村,37070114,2015/1/5 21:18,2015/1/5 21:18,工商银行,199,884710.59,4445.781859
山东省,威海市荣成市城西街道办事处小圈村,威海市荣成县石岛镇大渔岛村助农服务点,37100084,2015/1/5 21:19,2015/1/5 21:19,中国银行,153,2903084.41,18974.40791
山东省,威海市荣成市港湾街道办事处大鱼岛社区,威海市荣成县石岛镇大渔岛村码头助农服务点,37100085,2015/1/5 21:22,2015/1/5 21:22,中国银行,114,555875.49,4876.100789
河南省,濮阳市濮阳县清河头乡东清河头村,濮阳市濮阳县清河头乡,41090006,2015/1/5 21:23,2015/1/5 21:23,中国银行,242,315153.13,1302.285661
山东省,威海市文登市侯家镇崔家村,威海市文登县葛家镇西崔家口村助农服务点,37100086,2015/1/5 21:24,2015/1/5 21:24,中国银行,71,96233.09,1355.395634
山东省,威海市文登市米山镇米山村,米山村,37100088,2015/1/5 21:27,2014/2/20 0:00,中国银行,0,1040000,\N
河南省,周口市郸城县宁平镇,乔集助农取款点,41160003,2015/1/14 0:00,2015/1/5 21:28,中国银行,196,1910450.41,9747.195969
山东省,威海市文登市泽库镇泽库村,"威海市文登县泽库镇后岛村助农服务点
",37100089,2015/1/5 21:28,2015/1/5 21:28,中国银行,0,1803581.39,\N
河南省,濮阳市清丰县古城乡古城集村,濮阳市清丰县古城乡,41090007,2015/1/5 21:29,2015/1/5 21:29,中国银行,830,2201584.96,2652.512
山东省,济南市长清区平安街道办事处南桥村,山东省济南市长清区平安街道南桥村,37010288,2015/1/5 21:30,2015/1/5 21:30,中国银行,47,39652.1,843.661702
山东省,济南市天桥区泺口街道办事处北闸子社区,济南市天桥区泺口街道办事处北闸子社区助农服务点,37010289,2015/1/5 21:31,2015/1/5 21:31,中国银行,195,577388.26,2960.965436
山东省,济南市长清区崮云湖街道办事处坡庄村,济南市长清区崮云湖街道办事处坡庄村助农服务点,37010290,2015/1/5 21:33,2015/1/5 21:33,中国银行,51,181.3,3.554902
河南省,濮阳市华龙区胡村乡孟村,濮阳市高新区孟村,41090008,2015/1/5 21:35,2015/1/5 21:35,中国银行,326,2949462.91,9047.432239
山东省,威海市荣成市滕家镇李家屯村,李家屯村,37100096,2015/1/5 21:40,2015/1/5 21:40,中国银行,0,0,\N
山东省,威海市环翠区草庙子镇打铁村,打铁村,37100097,2015/1/5 21:41,2015/1/5 21:41,中国银行,0,0,\N
河南省,许昌市许昌县椹涧乡南头村,许昌县椹涧镇南头村,41100002,2015/1/5 21:42,2015/1/5 21:42,中国银行,372,885202.49,2379.576586
山东省,潍坊市坊子区荆山洼镇姜家庄村,姜家庄,37070117,2015/1/5 21:43,2015/1/5 21:43,工商银行,150,1306063.81,8707.092067
河南省,周口市郸城县宜路镇徐庄村,王老家助农取款点,41160004,2015/1/5 21:44,2015/1/5 21:44,中国银行,648,4706604.42,7263.278426
山东省,威海市文登市天福路街道办事处小五里头社区居委,威海市文登区泽库镇金屋子精品屋助农服务点,37100100,2015/1/5 21:47,2015/1/5 21:47,中国银行,65,9530741.09,146626.786
河南省,周口市商水县黄寨镇郑埠口村,周口市商水县黄寨镇郑埠口村周文军助农金融,41160005,2015/1/5 21:51,2015/1/5 21:51,中国银行,506,1167153.44,2306.627352
山东省,济南市章丘市刁镇周贾村,济南市章丘市刁镇周贾村助农服务点,37010305,2015/1/5 22:03,2015/1/5 22:03,中国银行,1,5998.02,5998.02
山东省,济南市章丘市明水街道办事处王家寨村,济南市章丘市明水街道办事处王家寨村助农服务点,37010311,2015/1/5 22:12,2015/1/5 22:12,中国银行,155,1457062.75,9400.404839
山东省,济南市章丘市绣惠镇东南隅村,济南市章丘市绣惠镇东南隅村助农服务点,37010316,2015/1/5 22:19,2015/1/5 22:19,中国银行,75,4468.48,59.579733
山东省,潍坊市安丘市景芝镇代家庄村,代家庄村,37070126,2015/1/5 22:21,2015/1/5 22:21,工商银行,0,0,\N
山东省,济南市章丘市文祖镇西窑头村,济南市章丘市文祖镇西窑头村助农服务点,37010321,2015/1/5 22:24,2015/1/5 22:24,中国银行,20,4633893.27,231694.6635
山东省,济南市章丘市普集镇海东村,济南市章丘市普集镇海套园东村助农服务点,37010323,2015/1/5 22:26,2015/1/5 22:26,中国银行,3,150054.63,50018.21
山东省,潍坊市坊子区穆村镇杨庄村,杨庄,37070133,2015/1/5 23:08,2015/1/5 23:08,工商银行,0,0,\N
山东省,潍坊市坊子区坊安街道办事处洼里村,洼里村,37070135,2015/1/5 23:12,2015/1/5 23:12,工商银行,261,936652.64,3588.707433
河南省,周口市川汇区城南办事处刘方平村,周口市川汇区南郊乡刘方平村,41160006,2015/1/5 23:22,2015/1/5 23:22,中国银行,522,3135341.51,6006.40136
河南省,周口市商水县谭庄镇谭庄村,周口市商水县谭庄王云山助农金融,41160007,2015/1/5 23:31,2015/1/5 23:31,中国银行,1094,1485082.51,1357.479442
河北省,秦皇岛市山海关区石河镇毛家沟村,山海关毛家沟,13030022,2015/1/6 8:24,2015/1/6 8:24,中国银行,108,310000,2870.37037
河北省,廊坊市大城县大尚屯镇冯张街村,大城县大尚屯镇冯张街村,13100027,2015/1/6 8:33,2015/1/6 8:33,中国银行,610,9350000,15327.86885
河北省,石家庄市无极县北苏镇史村,无极县北苏镇史村助农点,13010183,2015/1/6 8:48,2015/1/6 8:48,中国银行,1300,14670000,11284.61539
河北省,秦皇岛市抚宁县牛头崖镇牛头崖村,抚宁县牛头崖镇牛头崖村,13030023,2015/1/6 8:53,2015/1/6 8:53,中国银行,172,680000,3953.488372
河北省,石家庄市无极县郭庄镇西牛村,无极县郭庄镇西牛村助农点,13010184,2015/1/6 8:56,2015/1/6 8:56,中国银行,178,530000,2977.52809
河北省,秦皇岛市北戴河区戴河镇戴河村,戴河镇北戴河村,13030024,2015/1/6 8:59,2015/1/6 8:59,中国银行,158,1300000,8227.848101
河北省,石家庄市元氏县苏阳乡李家庄村,元氏县苏阳乡李家庄,13010185,2015/1/6 8:59,2015/1/6 8:59,中国银行,401,7490000,18678.30424
河北省,石家庄市无极县北苏镇北苏村,无极县北苏镇北苏村刘会然助农点,13010186,2015/1/6 9:03,2015/1/6 9:03,中国银行,463,10600000,22894.16847
河北省,秦皇岛市青龙满族自治县青龙镇孟家铺村,青龙县青龙镇孟家铺村,13030026,2015/1/6 9:06,2015/1/6 9:06,中国银行,323,2400000,7430.340557
河南省,新乡市辉县市孟庄镇涧头村,辉县市孟庄镇涧头社区助农取款服务点,41070008,2015/1/6 9:07,2015/1/6 9:07,中国银行,292,1752741.48,6002.539315
河北省,石家庄市元氏县赵同乡赵同村,元氏县赵同乡赵同村,13010190,2015/1/6 9:12,2015/1/6 9:12,中国银行,399,4920000,12330.82707
河北省,秦皇岛市青龙满族自治县土门子乡西蒿村,青龙县土门子镇西蒿村,13030028,2015/1/6 9:16,2015/1/6 9:16,中国银行,558,2950000,5286.738351
河北省,石家庄市鹿泉市铜冶镇北故邑村,鹿泉区铜冶镇北故邑村,13010193,2015/1/6 9:18,2015/1/6 9:18,中国银行,289,2440000,8442.906574
河北省,秦皇岛市抚宁县深河乡北庄河村,深河镇北庄河村,13030029,2015/1/6 9:21,2015/1/6 9:21,中国银行,476,4820000,10126.05042
河北省,石家庄市正定县北早现乡南岗村,正定县北早现乡南岗村,13010196,2015/1/6 9:22,2015/1/6 9:22,中国银行,118,2120000,17966.1017
河南省,商丘市柘城县安平镇安平村,柘城县安平镇安平开发区助农服务取款点,41140571,2015/1/6 9:25,2015/1/6 9:25,中国银行,877,5507032.21,6279.398187
河北省,石家庄市元氏县宋曹镇大孔村,元氏县宋曹镇大孔村,13010199,2015/1/6 9:25,2015/1/6 9:25,中国银行,505,9950000,19702.9703
河北省,石家庄市无极县东侯坊乡古庄村,无极县东侯坊乡古庄村助农点,13010201,2015/1/6 9:35,2015/1/6 9:35,中国银行,1105,17400000,15746.60634
河北省,石家庄市晋州市总十庄镇孔目庄村,晋州市总十庄镇孔目庄村,13010202,2015/1/6 9:40,2015/1/6 9:40,中国银行,452,6110000,13517.69912
河北省,秦皇岛市抚宁县抚宁镇陈各庄村,抚宁县抚宁镇陈各庄村,13030030,2015/1/6 9:40,2015/1/6 9:40,中国银行,253,1680000,6640.316206
河北省,秦皇岛市卢龙县双望镇马各庄村,双望镇马各庄,13030031,2015/1/6 9:44,2015/1/6 9:44,中国银行,158,1250000,7911.392405
河北省,石家庄市晋州市桃园镇赵兰庄村,晋州市桃园镇赵兰庄村,13010203,2015/1/6 9:44,2015/1/6 9:44,中国银行,443,6110000,13792.32506
山东省,菏泽市曹县苏集镇北三村行政村,菏泽曹县砖庙镇十三村,37170086,2015/1/6 9:45,2015/1/6 9:45,中国银行,0,0,\N
山东省,菏泽市曹县桃源集镇常庙中街行政村,菏泽曹县桃源镇常岗村,37170087,2015/1/6 9:47,2015/1/6 9:47,中国银行,0,0,\N
河北省,石家庄市鹿泉市铜冶镇南铜冶村,鹿泉区铜冶镇南铜冶村,13010204,2015/1/6 9:49,2015/1/6 9:49,中国银行,79,1480000,18734.17722
