省,村名,站点,编号,签约时间,开业时间,银行,卡数,存款数,卡均
河北省,石家庄市正定县曲阳桥乡胡村,正定县曲阳桥乡胡村,1.30123E+12,2015/11/12 0:00,2015/11/12 0:00,张家口银行,65,179828.94,2766.599077
山东省,威海市文登市环山路街道办事处七里汤社区,威海市文登区宋村镇大泽头村助农服务点,3.71081E+12,2015/11/12 0:00,2016/2/22 0:00,中国银行,1,3850851,3850851
山东省,威海市文登市天福路街道办事处松坡社区,文登市天福路街道办事处松坡社区,3.71081E+12,2015/11/9 0:00,2015/11/9 0:00,中国银行,6,1808.37,301.395
山东省,威海市文登市侯家镇侯家村,文登市侯家镇侯家村,3.71081E+12,2015/11/9 0:00,2016/6/22 0:00,中国银行,0,0,\N
山东省,威海市文登市文登营镇,"威海市文登区文登营镇漩夼村助农服务点
",3.71081E+12,2015/11/9 0:00,2015/11/9 0:00,中国银行,1,176200.12,176200.12
山东省,威海市文登市张家产镇林家床村,文登市张家产镇林家床村,3.71081E+12,2015/11/9 0:00,2015/12/11 0:00,中国银行,0,0,\N
河北省,唐山市玉田县石臼窝镇观风堆村,玉田县石臼窝镇观凤堆村,1.30229E+12,2015/11/13 0:00,2015/6/3 0:00,中国银行,498,7220000,14497.99197
河北省,石家庄市栾城县窦妪镇南赵台村,栾城县窦妪镇南赵台村,1.30124E+12,2015/11/13 0:00,2015/11/6 0:00,张家口银行,0,0,\N
山东省,威海市环翠区初村镇冢子庄村,环翠区初村镇冢子庄村,3.71002E+12,2015/11/13 0:00,2015/12/18 0:00,中国银行,0,0,\N
河北省,石家庄市鹿泉市宜安镇东焦中队村,鹿泉市宜安镇东焦中队村,1.30185E+12,2015/11/12 0:00,2015/11/12 0:00,张家口银行,17,104941.35,6173.020588
河北省,唐山市迁安市沙河驿镇管庄子村,迁安市沙河驿镇管庄子村,1.30283E+12,2015/11/14 0:00,2016/4/28 0:00,中国银行,109,10000,91.743119
河北省,唐山市迁安市沙河驿镇下炉村,迁安市沙河驿镇下炉村,1.30283E+12,2015/11/14 0:00,2016/4/10 0:00,中国银行,110,120000,1090.909091
河北省,承德市兴隆县平安堡镇荞麦岭村,兴隆县平安堡镇荞麦岭村,1.30822E+12,2015/11/15 0:00,2016/3/20 0:00,中国银行,84,360000,4285.714286
河北省,衡水市枣强县新屯乡王新屯村,枣强县新屯乡王新屯村,1.31121E+12,2015/11/16 0:00,2016/6/24 0:00,中国银行,0,0,\N
山东省,威海市环翠区桥头镇报信村,环翠区桥头镇报信村,3.71002E+12,2015/11/16 0:00,2016/5/13 0:00,中国银行,0,0,\N
河北省,石家庄市无极县南流乡大中郎村,无极县南流乡大中郎村张家口银行,1.3013E+12,2015/11/17 0:00,2015/11/17 0:00,张家口银行,1465,18514107.56,12637.61608
河北省,石家庄市无极县张段固镇东两河村,无极县张段固镇东两河张家口银行村,1.3013E+12,2015/11/17 0:00,2015/11/17 0:00,张家口银行,89,1543018.74,17337.28921
河北省,石家庄市无极县张段固镇西两河村,无极县张段固镇东南丰村,1.3013E+12,2015/11/17 0:00,2016/1/29 0:00,张家口银行,20,336700,16835
河北省,石家庄市无极县张段固镇苌家庄村,无极县张段固镇苌家庄村张家口,1.3013E+12,2015/11/17 0:00,2015/11/17 0:00,张家口银行,161,1891275,11747.04969
河北省,石家庄市栾城县窦妪镇北赵台村,栾城县窦妪镇北赵台村张家口银行,1.30124E+12,2015/11/17 0:00,2015/11/17 0:00,张家口银行,314,3259875.38,10381.76873
河北省,石家庄市栾城县郄马镇信家庄村,栾城县郄马镇信家庄村,1.30124E+12,2015/11/17 0:00,2015/11/17 0:00,张家口银行,0,0,\N
河北省,石家庄市栾城县西营乡,栾城县西营乡后牛村,1.30124E+12,2015/11/17 0:00,2015/11/17 0:00,张家口银行,0,0,\N
河北省,石家庄市栾城县西营乡赵家庄村,栾城县西营乡赵家庄村张家口银行,1.30124E+12,2015/11/17 0:00,2015/11/17 0:00,张家口银行,1,411.28,411.28
山东省,烟台市莱山区解甲庄镇新天堡村,莱山区马山街道新添堡,3.70613E+12,2015/11/17 0:00,2016/2/18 0:00,中国银行,0,1872970.64,\N
河北省,石家庄市栾城县窦妪镇窦妪村,栾城县窦妪镇窦妪村,1.30124E+12,2015/11/17 0:00,2015/11/17 0:00,张家口银行,5,7507.57,1501.514
河北省,承德市宽城满族自治县板城镇椴树沟村,宽城满族自治县板城镇椴树沟村,1.30827E+12,2015/11/18 0:00,2016/3/4 0:00,中国银行,101,380000,3762.376238
河北省,承德市宽城满族自治县苇子沟乡三旗杆村,宽城满族自治县苇子沟乡三旗杆村,1.30827E+12,2015/11/18 0:00,2016/4/8 0:00,中国银行,34,0,0
河北省,沧州市青县陈嘴乡吴辛庄村,青县陈嘴乡吴辛庄村,1.30922E+12,2015/11/18 0:00,2016/1/29 0:00,中国银行,4404,560000,127.15713
河北省,石家庄市藁城市廉州镇五里庄村,藁城市廉州镇五里庄村二站,1.30182E+12,2015/11/18 0:00,2015/11/18 0:00,张家口银行,0,0,\N
河北省,石家庄市藁城市梅花镇西白露村,藁城市梅花镇西白露村,1.30182E+12,2015/11/18 0:00,2015/11/18 0:00,张家口银行,0,0,\N
河北省,石家庄市藁城市贾市庄镇刘海庄村,藁城市贾市庄镇刘海庄村,1.30182E+12,2015/11/18 0:00,2016/1/29 0:00,张家口银行,117,1985479.3,16969.90855
河北省,石家庄市藁城市贾市庄镇张名甫村,藁城市贾市庄镇张名甫村,1.30182E+12,2015/11/18 0:00,2015/11/18 0:00,张家口银行,18,1221029.96,67834.99778
河北省,衡水市饶阳县留楚乡东九吉村,饶阳县留楚乡东九吉村,1.31124E+12,2015/11/19 0:00,2016/3/3 0:00,中国银行,0,0,\N
河北省,沧州市青县金牛镇大牛庄村,青县金牛镇大牛庄村,1.30922E+12,2015/11/16 0:00,2016/1/27 0:00,中国银行,1533,450000,293.542074
河北省,唐山市迁安市杨各庄镇高各庄村,迁安市杨各庄镇高各庄村,1.30283E+12,2014/12/3 0:00,2014/12/3 0:00,中国银行,510,380000,745.098039
甘肃省,兰州市永登县秦川镇五道岘村,永登县秦川镇五道岘村,6.20121E+12,2015/11/19 0:00,2015/11/30 0:00,中国银行,0,0,\N
河北省,石家庄市栾城县西营乡后小梅村,栾城县西营乡后小梅村,1.30124E+12,2015/11/19 0:00,2015/11/19 0:00,张家口银行,0,0,\N
河北省,沧州市南皮县大浪淀乡祁家洼村,南皮县大浪淀乡祁家洼村,1.30927E+12,2015/11/19 0:00,2016/5/10 0:00,中国银行,0,0,\N
山东省,威海市荣成市王连街道办事处王家庄村,荣成市王连街道办事处王家庄村,3.71082E+12,2015/11/19 0:00,2015/11/19 0:00,中国银行,0,0,\N
山东省,威海市荣成市王连街道办事处隋家庄村,荣成市王连街道办事处隋家庄村,3.71082E+12,2015/11/19 0:00,2015/11/19 0:00,中国银行,0,0,\N
山东省,威海市荣成市王连街道办事处寨前王家村,荣成市王连街道办事处寨前王家村,3.71082E+12,2015/11/19 0:00,2015/11/19 0:00,中国银行,0,100000,\N
山东省,威海市荣成市王连街道办事处,荣成市王连街道办事处松顶后村,3.71082E+12,2015/11/19 0:00,2015/11/19 0:00,中国银行,0,0,\N
山东省,威海市荣成市王连街道办事处店子村,荣成市王连街道办事处店子村,3.71082E+12,2015/11/19 0:00,2015/11/19 0:00,中国银行,0,1055000,\N
山东省,威海市荣成市王连街道办事处寨前于家村,荣成市王连街道办事处寨前于家村,3.71082E+12,2015/11/19 0:00,2015/11/19 0:00,中国银行,0,207771,\N
山东省,威海市荣成市王连街道办事处南也子口村,荣成市王连街道办事处南也子口村,3.71082E+12,2015/11/19 0:00,2015/11/19 0:00,中国银行,0,0,\N
山东省,威海市荣成市王连街道办事处马岭孙家村,荣成市王连街道办事处马岭孙家村,3.71082E+12,2015/11/19 0:00,2015/11/19 0:00,中国银行,0,0,\N
山东省,威海市荣成市王连街道办事处寨前赛家村,荣成市王连街道办事处寨前赛家村,3.71082E+12,2015/11/19 0:00,2015/11/19 0:00,中国银行,0,126000,\N
山东省,威海市荣成市王连街道办事处上夼村,荣成市王连街道办事处上夼村,3.71082E+12,2015/11/19 0:00,2015/11/19 0:00,中国银行,0,108900,\N
山东省,威海市荣成市王连街道办事处常家庄村,荣成市王连街道办事处常家庄村,3.71082E+12,2015/11/19 0:00,2015/11/19 0:00,中国银行,0,383021.45,\N
山东省,烟台市龙口市北马镇南栾堡村,龙口市北马镇南栾堡村,3.70681E+12,2015/11/19 0:00,2016/1/27 0:00,中国银行,0,0,\N
山东省,威海市荣成市王连街道办事处,荣成市王连街道办事处寨前峨石村-姜秀卿,3.71082E+12,2015/11/19 0:00,2015/11/19 0:00,中国银行,0,83000,\N
山东省,烟台市龙口市芦头镇芦头村,龙口市芦头镇芦头村,3.70681E+12,2015/11/18 0:00,2015/11/18 0:00,中国银行,0,0,\N
山东省,烟台市龙口市徐福镇冯高后村,龙口市徐福镇冯高后村,3.70681E+12,2015/11/18 0:00,2015/11/18 0:00,中国银行,0,1358000,\N
山东省,烟台市龙口市东江镇崖头村,龙口市东江镇崖头村,3.70681E+12,2015/11/18 0:00,2015/11/18 0:00,中国银行,1,583762.96,583762.96
河北省,石家庄市藁城市小常安镇里庄村,藁城市小常安镇里庄村,1.30182E+12,2015/11/20 0:00,2015/11/20 0:00,张家口银行,880,11363802.5,12913.41193
河北省,石家庄市藁城市廉州镇北营村,藁城市廉州镇北营村,1.30182E+12,2015/11/20 0:00,2015/11/20 0:00,张家口银行,0,0,\N
河北省,石家庄市藁城市廉州镇南墩村,藁城市廉州镇南墩村2,1.30182E+12,2015/11/20 0:00,2015/11/20 0:00,张家口银行,758,11372763.36,15003.64559
河北省,石家庄市藁城市岗上镇双庙村,藁城市岗上镇双庙村3,1.30182E+12,2015/11/20 0:00,2015/11/20 0:00,张家口银行,35,344000,9828.571429
河北省,石家庄市藁城市廉州镇陈家庄三排村,藁城市廉州镇陈家庄三排村2,1.30182E+12,2015/11/20 0:00,2015/11/20 0:00,张家口银行,537,8584980.53,15986.92836
山东省,潍坊市寿光市纪台镇王辛庄子村,寿光市纪台镇王辛庄子村,3.70783E+12,2015/11/21 0:00,2015/11/21 0:00,工商银行,0,0,\N
河北省,石家庄市栾城县楼底镇于底村,栾城县楼底镇于底村,1.30124E+12,2015/11/20 0:00,2015/11/20 0:00,张家口银行,0,0,\N
山东省,烟台市海阳市方圆街道沟于家村,海阳市方圆街道沟于家村,3.70687E+12,2015/11/22 0:00,2016/3/11 0:00,中国银行,16,841685.39,52605.33688
山东省,威海市荣成市夏庄镇二胪村,荣成夏庄二胪闫淑霞助农服务点,3.71082E+12,2015/11/23 0:00,2016/3/7 0:00,中国银行,5,736543.09,147308.618
山东省,威海市文登市苘山镇山马程村,文登市苘山镇山马程村助农服务点,3.71081E+12,2015/11/23 0:00,2015/11/23 0:00,中国银行,0,198047.81,\N
山东省,烟台市莱州市驿道镇三元村,莱州市驿道镇三元村,3.70683E+12,2015/11/23 0:00,2016/1/5 0:00,中国银行,104,815668.16,7842.963077
山东省,威海市文登市泽头镇岛集村,文登市泽头镇岛集村,3.71081E+12,2015/11/22 0:00,2016/3/5 0:00,中国银行,82,420065.64,5122.751707
山东省,烟台市莱州市城港路街道东郎子埠村,莱州市城港路街道东郎子埠村,3.70683E+12,2015/11/23 0:00,2016/1/23 0:00,中国银行,2,1,0.5
河北省,沧州市青县流河镇大邵庄村,青县流河镇大邵庄村,1.30922E+12,2015/11/17 0:00,2016/1/25 0:00,中国银行,1121,210000,187.332739
山东省,威海市文登市宋村镇大床村,"文登市宋村镇大床村助农服务点
",3.71081E+12,2015/11/24 0:00,2015/12/11 0:00,中国银行,1,936765.41,936765.41
山东省,威海市文登市泽头镇西程格村,"文登市泽头镇西程格村服务点
",3.71081E+12,2015/11/24 0:00,2015/11/24 0:00,中国银行,1,1655989.14,1655989.14
山东省,烟台市莱州市驿道镇玉兰埠村,莱州市驿道镇玉兰埠村,3.70683E+12,2015/11/23 0:00,2015/9/12 0:00,中国银行,0,1360000,\N
山东省,烟台市莱州市城港路街道小原王家村,莱州市城港路街道盛泰货运助农服务点,3.70683E+12,2015/11/23 0:00,2015/11/24 0:00,中国银行,84,38269.01,455.583452
山东省,烟台市莱州市沙河镇,莱州市沙河镇杜振芳助农服务点,3.70683E+12,2015/11/23 0:00,2016/1/23 0:00,中国银行,64,439.61,6.868906
山东省,威海市乳山市育黎镇塔庄村,乳山市育黎镇塔庄村,3.71083E+12,2015/11/24 0:00,2015/12/30 0:00,中国银行,5,635634.38,127126.876
山东省,威海市乳山市育黎镇曲水村,乳山市育黎镇曲水村,3.71083E+12,2015/11/24 0:00,2015/12/30 0:00,中国银行,6,219407.33,36567.88833
河北省,沧州市青县马厂镇何老营村,青县马厂镇何老营村,1.30922E+12,2015/11/25 0:00,2016/1/27 0:00,中国银行,3542,1250000,352.907962
山东省,潍坊市安丘市凌河镇富家庄子村,安丘市凌河镇富家庄子村,3.70784E+12,2015/11/25 0:00,2016/1/29 0:00,工商银行,19,81.55,4.292105
四川省,达州市通川区罗江镇高石村,通川区罗江镇高石村,5.11702E+12,2015/11/25 0:00,2015/12/15 0:00,中国银行,178,1467310.32,8243.316404
山东省,潍坊市安丘市凌河镇刘家河头村,安丘市凌河镇刘家河头村,3.70784E+12,2015/11/25 0:00,2016/1/29 0:00,工商银行,34,20193.29,593.920294
河北省,唐山市玉田县唐自头镇石岭口村,玉田县唐自头镇石岭口村,1.30229E+12,2015/11/25 0:00,2015/11/25 0:00,中国银行,337,3270000,9703.264095
山东省,威海市文登市界石镇楚岘村,"威海市文登县界石镇楚岘村张锋锐助农服务点
",3.71081E+12,2015/11/26 0:00,2015/11/24 0:00,中国银行,0,61311.45,\N
山东省,聊城市东昌府区凤凰街道办事处,聊城市东昌府区南郑楼村助农点,3.71502E+12,2015/11/26 0:00,2015/12/3 0:00,中国银行,177,6684881.97,37767.69475
河北省,石家庄市无极县张段固镇耿家庄村,无极县张段固镇耿家庄村,1.3013E+12,2015/11/17 0:00,2016/3/1 0:00,张家口银行,1,11.96,11.96
河北省,石家庄市元氏县因村镇南吴会村,元氏县因村镇南吴会村电商,1.30132E+12,2015/11/26 0:00,2016/3/28 0:00,平安银行,1,0,0
山东省,聊城市东昌府区道口铺街道办事四甲李村,东昌府区道口铺街道办事四甲李村,3.71502E+12,2015/11/26 0:00,2016/2/26 0:00,中国银行,0,0,\N
河北省,衡水市武邑县审坡镇后泊庄村,武邑县审坡镇后泊庄村,1.31122E+12,2015/11/26 0:00,2016/2/20 0:00,中国银行,163,1290000,7914.110429
山东省,聊城市茌平县乐平铺镇南街村,聊城茌平县乐平铺镇三十里铺助农点,3.71523E+12,2015/11/27 0:00,2016/1/24 0:00,中国银行,0,0,\N
河北省,唐山市迁安市扣庄乡东牛山村,迁安市扣庄乡东牛山村,1.30283E+12,2015/6/3 0:00,2014/12/3 0:00,中国银行,215,120000,558.139535
甘肃省,兰州市七里河区八里镇政府崖头村,七里河区八里镇政府崖头村,6.20103E+12,2015/11/27 0:00,2016/4/12 0:00,中国银行,139,582743.22,4192.397266
河北省,石家庄市辛集市天宫营乡西朗月村,辛集市天宫营乡西朗月村,1.30181E+12,2015/11/27 0:00,2016/3/12 0:00,平安银行,23,11544.75,501.945652
甘肃省,兰州市七里河区八里镇政府八里窑村,七里河区八里镇政府八里窑村,6.20103E+12,2015/11/27 0:00,2016/4/12 0:00,中国银行,0,0,\N
河北省,石家庄市藁城市南董镇南大章村,藁城市南董镇南大章村二站,1.30182E+12,2015/10/15 0:00,2015/10/15 0:00,张家口银行,395,4619413.32,11694.71727
河北省,石家庄市正定县北早现乡南早现村,正定县北早现乡南早现村张家口银行,1.30123E+12,2015/11/27 0:00,2015/11/27 0:00,张家口银行,2,826.05,413.025
河北省,石家庄市藁城市增村镇牛家庄村,藁城市增村镇牛家庄村,1.30182E+12,2015/11/27 0:00,2015/11/27 0:00,张家口银行,0,0,\N
山东省,威海市文登市宋村镇上徐村,"威海市文登县宋村镇上徐村助农服务点
",3.71081E+12,2015/11/24 0:00,2015/11/5 0:00,中国银行,1,4574707.37,4574707.37
山东省,威海市乳山市白沙滩镇大单家村,乳山市白沙滩镇大单家村,3.71083E+12,2015/11/27 0:00,2015/12/20 0:00,中国银行,4,1035633.88,258908.47
河北省,衡水市桃城区河东街道办事处周通村,衡水市周通村,1.31122E+12,2015/11/27 0:00,2016/2/20 0:00,中国银行,72,4590000,63750
山东省,威海市环翠区崮山镇岭后村,环翠区崮山镇岭后村,3.71002E+12,2015/11/27 0:00,2016/5/13 0:00,中国银行,0,0,\N
山东省,威海市环翠区张村镇姜南庄村,环翠区张村镇姜南庄村,3.71002E+12,2015/11/27 0:00,2016/4/1 0:00,中国银行,616,10661028.17,17306.86391
山东省,烟台市栖霞市桃村镇营盘村,栖霞市桃村镇营盘村,3.70686E+12,2015/11/27 0:00,2015/7/3 0:00,中国银行,0,31561,\N
山东省,烟台市蓬莱市小门家镇卧龙村,蓬莱市小门家镇卧龙村,3.70684E+12,2015/11/27 0:00,2015/6/3 0:00,中国银行,6,1235869.61,205978.2683
河北省,沧州市南皮县潞灌乡芦庄子村,南皮县潞灌乡芦庄子村,1.30927E+12,2015/11/28 0:00,2016/3/24 0:00,中国银行,135,1830000,13555.55556
河北省,石家庄市藁城市小常安镇大常安村,藁城市常安镇大常安村,1.30182E+12,2015/11/28 0:00,2015/11/27 0:00,张家口银行,495,6661717.11,13458.01436
河北省,石家庄市藁城市廉州镇常家庄村,藁城市廉州镇常家庄村二站,1.30182E+12,2015/11/27 0:00,2015/11/27 0:00,张家口银行,24,314470.89,13102.95375
河北省,唐山市丰南区东田庄乡新集村,丰南区东田庄乡新集村,1.30207E+12,2015/11/28 0:00,2016/4/30 0:00,中国银行,0,0,\N
河北省,石家庄市晋州市晋州镇樊庄村,晋州市晋州镇樊庄村一站,1.30183E+12,2015/6/12 0:00,2015/11/28 0:00,张家口银行,119,1430180,12018.31933
河北省,沧州市沧县姚官屯乡仁和村,沧县姚官屯乡仁和村,1.30921E+12,2015/11/29 0:00,2015/11/21 0:00,中国银行,290,6570000,22655.17241
河北省,衡水市饶阳县大官亭乡东张岗村,饶阳县大官亭乡东张岗村,1.31124E+12,2015/11/29 0:00,2016/3/4 0:00,中国银行,0,0,\N
甘肃省,兰州市七里河区西果园镇政府堡子村,七里河区西果园镇政府堡子村,6.20103E+12,2015/11/29 0:00,2016/4/16 0:00,中国银行,151,603508.34,3996.743974
山东省,滨州市博兴县陈户镇,博兴县陈户镇陈户村,3.71625E+12,2015/11/29 0:00,2016/6/17 0:00,中国银行,0,0,\N
河北省,石家庄市平山县上三汲乡北七汲村,平山县上三汲乡北七汲村平安,1.30131E+12,2015/11/29 0:00,2016/4/5 0:00,平安银行,1,0,0
山东省,聊城市冠县冠城镇东三里庄村,冠县冠城镇东三里庄村,3.71525E+12,2015/11/30 0:00,2015/12/3 0:00,中国银行,3,540367.26,180122.42
山东省,聊城市冠县冠城镇元庄村,聊城冠县清泉街道办事处元庄村助农点,3.71525E+12,2015/11/30 0:00,2016/1/24 0:00,中国银行,6,69344.88,11557.48
山东省,聊城市冠县冠城镇西街村,聊城冠县清泉街道西街村,3.71525E+12,2015/11/30 0:00,2016/3/15 0:00,中国银行,0,0,\N
山东省,聊城市冠县冠城镇寨里村,聊城冠县清泉街道办事处寨里村助农点,3.71525E+12,2015/11/30 0:00,2016/1/24 0:00,中国银行,3,35018.34,11672.78
河北省,唐山市遵化市西三里乡胡庄子村,遵化市西三里乡胡庄子村,1.30281E+12,2015/11/30 0:00,2016/1/25 0:00,中国银行,1432,920000,642.458101
山东省,威海市文登市大水泊镇大沟村,文登市大水泊镇大沟村,3.71081E+12,2015/11/30 0:00,2016/1/24 0:00,中国银行,1,4470002.24,4470002.24
甘肃省,兰州市永登县树屏镇哈家咀村,永登县树屏镇哈家咀村,6.20121E+12,2015/11/30 0:00,2016/4/12 0:00,中国银行,0,0,\N
山东省,聊城市冠县斜店乡前社庄村,聊城市冠县斜店乡前社庄村助农点,3.71525E+12,2015/11/30 0:00,2016/2/28 0:00,中国银行,0,0,\N
山东省,潍坊市寿光市孙家集街道,寿光市孙家集街道岳寺李,3.70783E+12,2015/11/30 0:00,2016/3/3 0:00,工商银行,150,5629324.59,37528.8306
河北省,石家庄市赵县北王里镇沟岸村,赵县北王里镇沟岸村中行,1.30133E+12,2015/11/30 0:00,2015/12/17 0:00,中国银行,237,1010000,4261.603376
河北省,石家庄市赵县南柏舍镇北李家疃村,赵县南柏舍镇北李家疃村,1.30133E+12,2015/11/30 0:00,2016/3/8 0:00,中国银行,218,1730000,7935.779817
河北省,石家庄市赵县范庄镇常信营村,赵县范庄镇常信营村,1.30133E+12,2015/11/30 0:00,2015/12/16 0:00,中国银行,665,8290000,12466.16541
河北省,石家庄市赵县谢庄乡安家庄村,赵县谢庄乡安家庄村,1.30133E+12,2015/11/30 0:00,2015/12/16 0:00,中国银行,446,4430000,9932.735426
河北省,石家庄市赵县谢庄乡郜家庄村,赵县谢庄乡郜家庄村电商,1.30133E+12,2015/11/30 0:00,2015/12/16 0:00,中国银行,592,5540000,9358.108108
河南省,许昌市许昌县长村张乡郭桥村,许昌县长村张乡郭桥村,4.11023E+12,2015/11/30 0:00,2016/2/20 0:00,中国银行,120,67380023.66,561500.1972
河北省,石家庄市赵县沙河店镇丁村,赵县沙河店镇丁村中行,1.30133E+12,2015/11/30 0:00,2015/12/17 0:00,中国银行,230,1220000,5304.347826
河北省,衡水市枣强县大营镇,枣强县大营镇陈庄村,1.31121E+12,2015/11/30 0:00,2015/12/3 0:00,中国银行,24,68239.01,2843.292083
河北省,唐山市丰润区丰润镇小八里村,丰润区丰润镇小八里村,1.30208E+12,2015/11/30 0:00,2015/11/30 0:00,中国银行,3139,13950000,4444.090475
河北省,沧州市盐山县圣佛镇西田村,盐山县圣佛镇西田村,1.30925E+12,2015/12/2 0:00,2015/12/2 0:00,中国银行,196,1560000,7959.183673
河北省,石家庄市晋州市槐树镇周村,晋州市槐树镇周村张商行,1.30183E+12,2015/12/2 0:00,2015/12/2 0:00,张家口银行,28,268651.94,9594.712143
河北省,唐山市丰润区石各庄镇许家哨村,丰润区石各庄镇许家哨村,1.30208E+12,2015/12/2 0:00,2015/12/2 0:00,中国银行,1830,3780000,2065.57377
河北省,石家庄市新乐市长寿街道办事处,新乐市长寿街道办事处头村张家口银行,1.30184E+12,2015/12/3 0:00,2015/12/3 0:00,张家口银行,15,96161.78,6410.785333
河北省,唐山市丰南区小集镇吕庄子村,丰南区小集镇吕庄子村,1.30207E+12,2015/12/4 0:00,2014/12/22 0:00,中国银行,196,4770000,24336.73469
河北省,石家庄市藁城市廉州镇毛庄村,藁城市廉州镇毛庄村张商行,1.30182E+12,2015/12/7 0:00,2015/12/7 0:00,张家口银行,984,11381284.34,11566.34587
河北省,石家庄市藁城市廉州镇郭庄村,藁城市廉州镇郭庄村张家口银行,1.30182E+12,2015/12/7 0:00,2015/12/7 0:00,张家口银行,477,6510991.5,13649.87736
山东省,聊城市茌平县博平镇北关村,茌平县博平镇北关村,3.71523E+12,2015/12/7 0:00,2015/12/7 0:00,中国银行,0,0,\N
山东省,德州市武城县郝王庄镇,武城县郝王庄镇东李古寺村,3.71428E+12,2015/12/7 0:00,2015/12/7 0:00,中国银行,87,5944507.62,68327.67379
河南省,商丘市永城市裴桥镇和顺村,永城市裴桥镇和顺村,4.11481E+12,2015/12/9 0:00,2016/2/19 0:00,中国银行,131,298031.45,2275.049237
河北省,唐山市滦县九百户镇大井峪村,滦县九百户镇大井峪村,1.30223E+12,2015/12/9 0:00,2015/12/9 0:00,中国银行,335,3300000,9850.746269
河北省,石家庄市无极县七汲镇西庄村,无极县七汲镇西庄村,1.3013E+12,2015/12/9 0:00,2015/12/9 0:00,张家口银行,284,2869730.68,10104.68549
河南省,商丘市夏邑县刘店集乡刘店村,夏邑县刘店集乡刘店村,4.11426E+12,2015/10/10 0:00,2015/10/10 0:00,中国银行,0,0,\N
山东省,威海市环翠区凤林街道办事处,威海经区凤林东海路助农点,3.71002E+12,2015/12/11 0:00,2015/12/18 0:00,中国银行,1,61607.91,61607.91
山东省,滨州市博兴县曹王镇西赵冯村村民委,博兴县曹王镇西赵冯村村民委,3.71625E+12,2015/12/11 0:00,2015/9/5 0:00,中国银行,131,1041147.12,7947.687939
山东省,潍坊市寿光市孙家集街道南王村,寿光市孙家集街道南王村,3.70783E+12,2015/12/11 0:00,2016/2/21 0:00,工商银行,266,8263430.34,31065.52759
河北省,石家庄市晋州市小樵镇光灿村,晋州市小樵镇光灿村张商行,1.30183E+12,2015/12/11 0:00,2015/12/11 0:00,张家口银行,0,0,\N
河北省,唐山市乐亭县毛庄乡后营村,乐亭县毛庄乡后营村,1.30225E+12,2015/12/13 0:00,2016/1/10 0:00,中国银行,117,1810000,15470.08547
河南省,南阳市新野县城郊乡,新野县城郊乡孟营,4.11329E+12,2015/12/14 0:00,2014/12/1 0:00,中国银行,250,5109231.87,20436.92748
甘肃省,兰州市永登县大同镇王家坪村,永登县大同镇王家坪村,6.20121E+12,2015/12/16 0:00,2016/4/17 0:00,中国银行,346,1895845.08,5479.32104
河北省,石家庄市藁城市南营镇顺中村,藁城市南营镇顺中村,1.30182E+12,2015/12/16 0:00,2015/12/16 0:00,张家口银行,190,3151755.51,16588.1869
河北省,石家庄市藁城市廉州镇陈家庄一排村,藁城市廉州镇陈家庄一排村,1.30182E+12,2015/12/16 0:00,2015/12/16 0:00,张家口银行,405,6926219.32,17101.7761
河北省,石家庄市藁城市兴安镇织锦村,藁城市兴安镇织锦村张商行,1.30182E+12,2015/12/16 0:00,2015/12/16 0:00,张家口银行,124,1499871.29,12095.73621
河北省,石家庄市藁城市小常安镇锁家寨村,藁城市小常安镇锁家寨张商行村,1.30182E+12,2015/12/16 0:00,2015/12/16 0:00,张家口银行,405,7501855.28,18523.09946
河北省,石家庄市藁城市兴安镇角中村,藁城市兴安镇角中村张商行,1.30182E+12,2015/12/16 0:00,2015/12/16 0:00,张家口银行,0,0,\N
河北省,唐山市遵化市建明镇,遵化市建明镇大于沟村,1.30281E+12,2015/12/17 0:00,2016/3/26 0:00,中国银行,1745,60000,34.383954
山东省,烟台市招远市辛庄镇老店村,招远市辛庄镇老店村（镇驻地经营）,3.70685E+12,2015/12/17 0:00,2015/12/17 0:00,中国银行,0,0,\N
山东省,烟台市招远市金岭镇掉钟头村,招远市金岭镇掉钟头村,3.70685E+12,2015/12/17 0:00,2015/12/17 0:00,中国银行,0,582138.52,\N
山东省,烟台市龙口市芦头镇麻家村,龙口市芦头镇麻家村,3.70681E+12,2015/12/18 0:00,2015/12/18 0:00,中国银行,0,0,\N
山东省,烟台市龙口市新嘉街道双徐村,龙口市新嘉街道双徐村,3.70681E+12,2015/12/18 0:00,2015/12/18 0:00,中国银行,0,0,\N
